{"describedBy": "https://schema.humancellatlas.org/type/protocol/biomaterial_collection/3.1.0/enrichment_protocol", "schema_type": "protocol", "protocol_core": {"protocol_id": "EnrichmentProtocol_1", "protocol_name": "EnrichProt1", "protocol_description": "Test Enrichment Protocol", "publication_doi": "19.1191/293245", "protocols_io_doi": "10.17504/protocols.io.mgjc3un", "document": "my_cool_protocol.pdf"}, "method": {"text": "enzymatic dissociation", "ontology": "EFO:0009128", "ontology_label": "enzymatic dissociation"}, "markers": "CD4+ CD8+", "minimum_size": 70.0, "maximum_size": 90.0, "provenance": {"document_id": "73001089-4129-4daf-81e7-aa47e05ca565", "submission_date": "2021-03-16T16:15:23.551Z", "update_date": "2021-03-16T16:15:47.580Z", "schema_major_version": 3, "schema_minor_version": 1}}